<?xml version="1.0" encoding="UTF-8" standalone="no" ?>
<!DOCTYPE courses SYSTEM "schedule.dtd">
<courses>
    <!-- Monday -->
    <course code="BLAW 3600">
        <booking instructor="Catherine Ryan" room="SW3 4785" bookingtype="Lab"/>
    </course>
    <course code="COMP 4735">
        <booking instructor="Mirela Gutica"  room="SW1 1205" bookingtype="Lec"/>
    </course>
    <course code="COMP 4735">
        <booking instructor="Mirela Gutica"  room="SE12 320" bookingtype="Lab"/>
    </course>

    <!-- Tuesday -->
    <course code="COMP 4977">
        <booking instructor="D`arcy Smith" room="SE12 325" bookingtype="Sem"/>
    </course>
    <course code="COMP 4560">
        <booking instructor="Brenda Fine"  room="SW5 1850" bookingtype="Lec"/>
    </course>
    <course code="COMP 4711">
        <booking instructor="James Parry"  room="SW5 1850" bookingtype="Lec"/>
    </course>
    <course code="COMP 4560">
        <booking instructor="Joseph Lo"    room="SE12 322" bookingtype="Lab"/>
    </course>

    <!-- Thursday -->
    <course code="COMP 4976">
        <booking instructor="Medhat Elmasry" room="SE12 308" bookingtype="Sem"/>
    </course>
    
</courses>