<?xml version="1.0" encoding="UTF-8" standalone="no" ?>
<!DOCTYPE periods SYSTEM "schedule.dtd">
<periods>
    <period time="830">
        <booking instructor="D`arcy Smith"   room="SE12 325" bookingtype="Sem" dayofweek="tue" coursename="COMP 4977"/>
        <booking instructor="Medhat Elmasry" room="SE12 308" bookingtype="Sem" dayofweek="thu" coursename="COMP 4976"/>
        <booking instructor="Catherine Ryan" room="SW5 1840" bookingtype="Lec" dayofweek="fri" coursename="BLAW 3600"/>
    </period>
    <period time="1130">
        <booking instructor="Mirela Gutica" room="SW1 1205" bookingtype="Lec" dayofweek="mon" coursename="COMP 4735"/>
        <booking instructor="Brenda Fine"   room="SW5 1850" bookingtype="Lec" dayofweek="tue" coursename="COMP 4560"/>
        <booking instructor="Mierla Gutica" room="SW3 1710" bookingtype="Lec" dayofweek="thu" coursename="COMP 4735"/>
    </period>
    <period time="1230">
        <booking instructor="Mierla Gutica"  room="SE12 320" bookingtype="Lab" dayofweek="mon" coursename="COMP 4735"/>
        <booking instructor="Medhat Elmasry" room="SE12 308" bookingtype="Sem" dayofweek="thu" coursename="COMP 4976"/>
        <booking instructor="Brenda Fine"    room="SW3 1750" bookingtype="Lec" dayofweek="fri" coursename="COMP 4560"/>
    </period>
</periods>